[
  {
    "name": "openSimplexNoise",
    "description": "Javascript implementation of OpenSimplex Noise.",
    "homepage": "https://github.com/blindman67/SimplexNoiseJS",
    "importPath": "https://cdn.jsdelivr.net/gh/blindman67/SimplexNoiseJS@master/simplexNoise.js",
    "defines": {
      "globals": ["openSimplexNoise"]
    }
  },
  {
    "name": "anime",
    "description": "Anime.js (/ˈæn.ə.meɪ/) is a lightweight JavaScript animation library with a simple, yet powerful API.",
    "homepage": "https://animejs.com",
    "packageName": "animejs",
    "defines": {
      "globals": ["anime"]
    }
  },
  {
    "name": "CCapture.js",
    "description": "A library to capture canvas-based animations at a fixed framerate",
    "homepage": "https://github.com/spite/ccapture.js#readme",
    "packageName": "ccapture.js",
    "defines": {
      "globals": ["CCapture"]
    }
  },
  {
    "name": "dat.gui",
    "description": "dat.gui is a lightweight controller library for JavaScript. It provides a highly customizable user interface building block called dat.gui. It has no dependencies on other libraries. Use it to easily build powerful and flexible user interfaces.",
    "homepage": "https://github.com/dataarts/dat.gui",
    "packageName": "dat.gui",
    "lifecycle": "legacy",
    "lastReviewed": "2026-08-12",
    "replacedBy": "lil-gui",
    "defines": {
      "globals": ["dat"]
    }
  },
  {
    "name": "lil-gui",
    "description": "A lightweight graphical user interface for changing variables in JavaScript.",
    "homepage": "https://lil-gui.georgealways.com/",
    "packageName": "lil-gui",
    "lastReviewed": "2026-08-12",
    "defines": {
      "globals": ["lil"]
    }
  }
]
