[
  {
    "name": "p5.sound",
    "homepage": "https://p5js.org/reference/p5.sound/",
    "description": "p5.sound extends p5 with Web Audio functionality including audio input, playback, analysis and synthesis.",
    "packageName": "p5.sound",
    "importPath": "https://cdn.jsdelivr.net/npm/p5.sound@$(P5SoundVersion)/dist/p5.sound.min.js",
    "defines": {
      "globals": [
        "getAudioContext",
        "loadSound",
        "setAudioContext",
        "userStartAudio",
        "userStopAudio"
      ],
      "p5": [
        "Amplitude",
        "AudioIn",
        "AudioVoice",
        "BandPass",
        "Biquad",
        "Compressor",
        "Convolver",
        "Delay",
        "Distortion",
        "Effect",
        "Envelope",
        "EQ",
        "FFT",
        "Filter",
        "Gain",
        "HighPass",
        "LowPass",
        "MonoSynth",
        "Noise",
        "OnsetDetect",
        "Oscillator",
        "Panner",
        "Panner3D",
        "Part",
        "Phrase",
        "PitchShifter",
        "PolySynth",
        "Pulse",
        "Reverb",
        "SawOsc",
        "Score",
        "SinOsc",
        "SoundFile",
        "SoundLoop",
        "SqrOsc",
        "TriOsc"
      ]
    }
  }
]
